{"schema":"struktly/record-bundle/v1","manifest":{"execution_id":"execution_test","provenance_id":"provenance_270c4047cefe9c5d91f4fbf8c8b22208485987e2c8c969ec149b2e01cb0863b3","revision":1,"disposition":"incomplete","payload_schema":"struktly/provenance/v1","payload_sha256":"a9ccce681394e34fbeb43b233b67e081e3711b13a88d5f58a9c84a0605637ad6","sealed_at":"2026-08-26T20:50:36Z","evidence_embedded":false},"sealed":{"schema":"struktly/provenance/v1","provenance_id":"provenance_270c4047cefe9c5d91f4fbf8c8b22208485987e2c8c969ec149b2e01cb0863b3","revision":1,"lifecycle":"sealed","disposition":"incomplete","created_at":"2026-08-26T20:50:36.151628Z","observed_at":"2026-08-26T20:50:36.211808Z","sealed_at":"2026-08-26T20:50:36.211808Z","execution":{"id":"execution_test","status":"running","agent_name":"codex","created_at":"2026-07-13T12:00:00Z","updated_at":"2026-07-13T12:00:00Z"},"repository":{"id":"repo_test","name":"Fixture","registered_revision":"0cbc218f3e55e52a88f1c00bc8cfeb215f50a6b4","execution_base_revision":"0cbc218f3e55e52a88f1c00bc8cfeb215f50a6b4"},"task":{"id":"task_test","title":"Provenance task","version":1,"contract_schema":"struktly/task-contract/v1","contract_identity":"32ccd322c674b800863ebdfc03a67a82652b535a415e38e29f5d646a61973899","contract":{"outcome":"Ship provenance","done_when":["provenance is reviewable"],"non_goals":[],"required_checks":["go test ./...","external-tool check"]}},"context":{"pinned":true,"scan_id":"scan_test","packet_schema":"struktly/packet/v2","packet_sha256":"fa3b5ee3226106170fbbf742bc255bfa0276a502fea2add9d5a1963fc85f26cf","artifact_intact":true},"sessions":[{"id":"session_claude","kind":"agent","provider":"claude","transport":"chat","access_mode":"read_write","enforcement":"provider_enforced","status":"idle","predecessor_session_id":"session_codex","handoff_brief":"Continue from the verified parser change.","handoff_brief_sha256":"c5944962b501baf7b0b5c41d5e2a7af3a28a810e3cfe685c39d4a76d3351220b","external_ref_sha256":"337121c6cc45a4ae65fc97311aa7e8a11fa1bd55ee34412f0e57f9ab4042b99b","started_at":"2026-07-13T12:00:00Z","updated_at":"2026-07-13T12:00:00Z"},{"id":"session_codex","kind":"agent","provider":"codex","transport":"chat","access_mode":"read_write","enforcement":"provider_enforced","status":"idle","runtime_descriptor":{"schema":"struktly/runtime-descriptor/v1","id":"codex","display_name":"Codex","source":"test","adapter_version":"test-v1","execution_location":"local","model_location":"","transports":["turn"],"transport_capabilities":{"turn":{"resume":true,"cancellation":true,"interrupt":false,"event_visibility":"structured"}},"capabilities":{"turn_execution":true,"interactive":false,"file_editing":false,"shell_execution":false,"resume":true,"permission_configuration":false,"local_execution":true,"structured_hook_events":false}},"runtime_descriptor_schema":"struktly/runtime-descriptor/v1","runtime_adapter_version":"test-v1","runtime_descriptor_sha256":"751c3e2f817b72ab35703948c855b801b238f2a6f1139ab9e86da461f04c356e","runtime_descriptor_verified":true,"resume_supported_at_admission":true,"external_ref_sha256":"dac17c9ce06613004c9b8ffc9fc3cadd9a28991627a29023945e3206b63fd974","started_at":"2026-07-13T12:00:00Z","updated_at":"2026-07-13T12:00:00Z"},{"id":"session_human","kind":"human","transport":"terminal","access_mode":"read_write","enforcement":"observed","status":"completed","started_at":"2026-07-13T12:00:00Z","ended_at":"2026-07-13T12:00:00Z","updated_at":"2026-07-13T12:00:00Z"}],"dispatches":[],"resumed_turns":[],"controls":{"mode":"ask","coverage_schema":"struktly/control-coverage/v2","coverage":[{"adapter":"struktly","action":"explicit_command","dimensions":{"filesystem":{"level":"observed","explanation":"Struktly fixes the working-copy directory and can observe resulting Git changes, but does not confine filesystem access.","evidence_source":"working copy and Git status"},"command":{"level":"struktly_enforced","explanation":"Struktly owns the explicit command start boundary; Ask and Locked can pause or deny that start. Child processes remain opaque.","evidence_source":"shell API boundary"},"network":{"level":"unsupported","explanation":"Network access by the command is neither intercepted nor recorded.","evidence_source":"adapter contract"},"secrets":{"level":"unsupported","explanation":"Environment and credential reads are neither intercepted nor recorded.","evidence_source":"adapter contract"},"git":{"level":"observed","explanation":"Resulting repository changes are visible; Git subcommands inside the process are not intercepted.","evidence_source":"working-copy Git status"},"external_tools":{"level":"unsupported","explanation":"External tools started by the command are not intercepted.","evidence_source":"adapter contract"},"event_capture":{"level":"observed","explanation":"The command result and bounded output are recorded as an Execution event.","evidence_source":"shell.command event"},"resume":{"level":"unsupported","explanation":"One-shot commands cannot be resumed.","evidence_source":"adapter contract"}}},{"adapter":"struktly","action":"retain_working_copy","dimensions":{"filesystem":{"level":"unsupported","explanation":"This boundary controls only the selected Git working-copy action.","evidence_source":"adapter contract"},"command":{"level":"unsupported","explanation":"No arbitrary command is exposed by this action.","evidence_source":"adapter contract"},"network":{"level":"unsupported","explanation":"No network boundary is involved.","evidence_source":"adapter contract"},"secrets":{"level":"unsupported","explanation":"No secret boundary is involved.","evidence_source":"adapter contract"},"git":{"level":"struktly_enforced","explanation":"Struktly owns and gates this Git working-copy lifecycle action.","evidence_source":"worktree service boundary"},"external_tools":{"level":"unsupported","explanation":"Provider and external-tool operations are outside this action.","evidence_source":"adapter contract"},"event_capture":{"level":"observed","explanation":"The completed working-copy action is recorded as an Execution event.","evidence_source":"worktree lifecycle event"},"resume":{"level":"unsupported","explanation":"The action is one-shot and cannot be resumed.","evidence_source":"adapter contract"}}},{"adapter":"struktly","action":"discard_working_copy","dimensions":{"filesystem":{"level":"unsupported","explanation":"This boundary controls only the selected Git working-copy action.","evidence_source":"adapter contract"},"command":{"level":"unsupported","explanation":"No arbitrary command is exposed by this action.","evidence_source":"adapter contract"},"network":{"level":"unsupported","explanation":"No network boundary is involved.","evidence_source":"adapter contract"},"secrets":{"level":"unsupported","explanation":"No secret boundary is involved.","evidence_source":"adapter contract"},"git":{"level":"struktly_enforced","explanation":"Struktly owns and gates this Git working-copy lifecycle action.","evidence_source":"worktree service boundary"},"external_tools":{"level":"unsupported","explanation":"Provider and external-tool operations are outside this action.","evidence_source":"adapter contract"},"event_capture":{"level":"observed","explanation":"The completed working-copy action is recorded as an Execution event.","evidence_source":"worktree lifecycle event"},"resume":{"level":"unsupported","explanation":"The action is one-shot and cannot be resumed.","evidence_source":"adapter contract"}}},{"adapter":"struktly","action":"force_discard_working_copy","dimensions":{"filesystem":{"level":"unsupported","explanation":"This boundary controls only the selected Git working-copy action.","evidence_source":"adapter contract"},"command":{"level":"unsupported","explanation":"No arbitrary command is exposed by this action.","evidence_source":"adapter contract"},"network":{"level":"unsupported","explanation":"No network boundary is involved.","evidence_source":"adapter contract"},"secrets":{"level":"unsupported","explanation":"No secret boundary is involved.","evidence_source":"adapter contract"},"git":{"level":"struktly_enforced","explanation":"Struktly owns and gates this Git working-copy lifecycle action.","evidence_source":"worktree service boundary"},"external_tools":{"level":"unsupported","explanation":"Provider and external-tool operations are outside this action.","evidence_source":"adapter contract"},"event_capture":{"level":"observed","explanation":"The completed working-copy action is recorded as an Execution event.","evidence_source":"worktree lifecycle event"},"resume":{"level":"unsupported","explanation":"The action is one-shot and cannot be resumed.","evidence_source":"adapter contract"}}},{"adapter":"struktly","action":"delete_task","dimensions":{"filesystem":{"level":"struktly_enforced","explanation":"Struktly deletes only validated managed artifact directories and any managed Working copies owned by the Task.","evidence_source":"Task deletion and artifact-root boundaries"},"command":{"level":"unsupported","explanation":"No arbitrary command is exposed by this action.","evidence_source":"adapter contract"},"network":{"level":"unsupported","explanation":"No network boundary is involved.","evidence_source":"adapter contract"},"secrets":{"level":"unsupported","explanation":"No secret boundary is involved.","evidence_source":"adapter contract"},"git":{"level":"struktly_enforced","explanation":"Managed Working copies are removed through Struktly's worktree service; the person's repository contents are not deleted.","evidence_source":"worktree service boundary"},"external_tools":{"level":"unsupported","explanation":"Provider and external-tool operations are outside this action.","evidence_source":"adapter contract"},"event_capture":{"level":"observed","explanation":"The admitted deletion is recorded against the Repository after Task-scoped state is removed.","evidence_source":"task.deleted event"},"resume":{"level":"unsupported","explanation":"Deletion is o